{
  "schema_version": "0.1.0",
  "canonical_symbol": "ETHUSDT",
  "venue": "binance",
  "captured_at": "2026-06-21T12:00:00.000000Z",
  "instrument_type": "perpetual",
  "regime": "range",
  "timeframes": {
    "1m": {
      "open": "3450.25",
      "high": "3452.80",
      "low": "3448.50",
      "close": "3451.40",
      "volume": "342.118",
      "realized_volatility_pct": "22.3",
      "atr_pct": "0.12",
      "bar_start_utc": "2026-06-21T11:59:00.000000Z",
      "bar_end_utc": "2026-06-21T12:00:00.000000Z"
    },
    "5m": {
      "open": "3448.00",
      "high": "3455.00",
      "low": "3446.50",
      "close": "3451.40",
      "volume": "1685.420",
      "realized_volatility_pct": "23.1",
      "atr_pct": "0.14",
      "bar_start_utc": "2026-06-21T11:55:00.000000Z",
      "bar_end_utc": "2026-06-21T12:00:00.000000Z"
    },
    "15m": {
      "open": "3440.00",
      "high": "3460.00",
      "low": "3435.00",
      "close": "3451.40",
      "volume": "4920.750",
      "realized_volatility_pct": "25.7",
      "atr_pct": "0.19",
      "bar_start_utc": "2026-06-21T11:45:00.000000Z",
      "bar_end_utc": "2026-06-21T12:00:00.000000Z"
    },
    "1h": {
      "open": "3425.00",
      "high": "3470.00",
      "low": "3420.00",
      "close": "3451.40",
      "volume": "19840.120",
      "realized_volatility_pct": "29.4",
      "atr_pct": "0.28",
      "bar_start_utc": "2026-06-21T11:00:00.000000Z",
      "bar_end_utc": "2026-06-21T12:00:00.000000Z"
    },
    "4h": {
      "open": "3400.00",
      "high": "3480.00",
      "low": "3390.00",
      "close": "3451.40",
      "volume": "78120.500",
      "realized_volatility_pct": "32.8",
      "atr_pct": "0.45",
      "bar_start_utc": "2026-06-21T08:00:00.000000Z",
      "bar_end_utc": "2026-06-21T12:00:00.000000Z"
    },
    "1d": {
      "open": "3380.00",
      "high": "3520.00",
      "low": "3350.00",
      "close": "3451.40",
      "volume": "385200.000",
      "realized_volatility_pct": "48.2",
      "atr_pct": "1.10",
      "bar_start_utc": "2026-06-20T00:00:00.000000Z",
      "bar_end_utc": "2026-06-21T00:00:00.000000Z"
    }
  },
  "derivatives_context": {
    "funding_rate": "0.00008",
    "funding_rate_next_at_utc": "2026-06-21T16:00:00.000000Z",
    "open_interest": "412800.500",
    "open_interest_usd": "1425569960.00",
    "mark_price": "3451.85",
    "last_price": "3451.40",
    "mark_last_spread_bps": "0.13",
    "liquidations_24h_long_usd": "8200000.00",
    "liquidations_24h_short_usd": "6100000.00"
  },
  "evidence_refs": [
    "specs/002-data-layer/fixtures/eth-perp-snapshot.json"
  ],
  "disclaimer_present": true,
  "notes": "Synthetic fixture for P1 data layer validation. Not real market data."
}
